{
  "schemaVersion": 1,
  "preset": "workspace-suite",
  "generatedAt": "2026-08-18T00:00:00.000Z",
  "compatibleHarness": {
    "version": "0.1.0-rc.7",
    "commit": "99f6f02fecdb7dff40c3fbc9470f5907c29f74ca"
  },
  "packages": {
    "@cyrus/dsh-personal-shell": {
      "version": "0.1.0-rc.7",
      "integrity": "aaaaaaaaaaaaaaaaaaaaaaaaaaaaaaaaaaaaaaaaaaaaaaaaaaaaaaaaaaaaaaaa",
      "source": "tgz",
      "role": "adapter",
      "bundle": true
    },
    "@cyrus/dsh-workbench": {
      "version": "0.1.0-rc.7",
      "integrity": "aaaaaaaaaaaaaaaaaaaaaaaaaaaaaaaaaaaaaaaaaaaaaaaaaaaaaaaaaaaaaaaa",
      "source": "tgz",
      "role": "core",
      "bundle": true,
      "requires": [
        "@cyrus/dsh-personal-shell"
      ]
    },
    "@cyrus/dsh-project-workbench-bridge": {
      "version": "0.1.0-rc.7",
      "integrity": "aaaaaaaaaaaaaaaaaaaaaaaaaaaaaaaaaaaaaaaaaaaaaaaaaaaaaaaaaaaaaaaa",
      "source": "tgz",
      "role": "bridge",
      "bundle": true,
      "requires": [
        "@cyrus/dsh-project-control",
        "@cyrus/dsh-workbench"
      ]
    }
  },
  "installOrder": [
    "@cyrus/dsh-personal-shell",
    "@cyrus/dsh-project-control",
    "@cyrus/dsh-workbench",
    "@cyrus/dsh-project-workbench-bridge"
  ]
}
